date,platform,sort_type,rank,product_name,brand,volume_ml,regular_price,discount,sales_price,rating,review_count,main_ingredients,ingredients,ing_source,url
2026-05-01,올리브영,판매량순,15,[장도연 PICK] 메디힐 마데카소사이드 흔적 리페어 세럼 40+40ml,메디힐,40ml,36900,39%,22400,4.7,41115,,"정제수, 글리세린, 부틸렌글라이콜, 프로판다이올, 1,2-헥산다이올, 나이아신아마이드, 글리세릴폴리메타크릴레이트, 판테놀, 베타인, 폴리글리세릴-10라우레이트, 아크릴레이트/C10-30알킬아크릴레이트크로스폴리머, 다이페닐다이메티콘, 트라이에틸헥사노인, 트로메타민, 마데카소사이드(540 ppm), 에틸헥실글리세린, 하이드로제네이티드레시틴, 잔탄검, 소듐하이알루로네이트, 병풀추출물(51 ppm), 아시아티코사이드(39 ppm), 서양배추출물, 연필향나무오일, 병풀잎추출물(21 ppm), 베타-글루칸, 다마스크장미꽃수, 멜론추출물, 오리스뿌리추출물, 서양송악잎/줄기추출물, 호호바씨오일, 광곽향오일, 불가리스쑥오일, 로즈마리잎오일, 토코페롤, 다이프로필렌글라이콜, 펜틸렌글라이콜, 카프릴릴/카프릴글루코사이드, 마데카식애씨드(0.00004 ppm), 아시아틱애씨드(0.00003 ppm), 세라마이드엔피",,https://www.oliveyoung.co.kr/store/goods/getGoodsDetail.do?goodsNo=A000000211119&dispCatNo=100000100010014&trackingCd=Cat100000100010014_Small&t_page=%EC%B9%B4%ED%85%8C%EA%B3%A0%EB%A6%AC%EA%B4%80&t_click=%EC%97%90%EC%84%BC%EC%8A%A4/%EC%84%B8%EB%9F%BC/%EC%95%B0%ED%94%8C_%EC%A0%84%EC%B2%B4__%EC%83%81%ED%92%88%EC%83%81%EC%84%B8&t_number=15
2026-05-01,올리브영,판매량순,16,[트러블모공] 디오디너리 나이아신아마이드 10% + 징크 1% 60ml,디오디너리,60ml,,,15700,4.7,11437,,"정제수, 나이아신아마이드(10%), 펜틸렌글라이콜, 징크피씨에이(징크로서,1%), 다이메틸아이소소바이드, 타마린드씨검, 잔탄검, 아이소세테스-20, 에톡시다이글라이콜, 페녹시에탄올, 클로페네신",,https://www.oliveyoung.co.kr/store/goods/getGoodsDetail.do?goodsNo=A000000158615&dispCatNo=100000100010014&trackingCd=Cat100000100010014_Small&t_page=%EC%B9%B4%ED%85%8C%EA%B3%A0%EB%A6%AC%EA%B4%80&t_click=%EC%97%90%EC%84%BC%EC%8A%A4/%EC%84%B8%EB%9F%BC/%EC%95%B0%ED%94%8C_%EC%A0%84%EC%B2%B4__%EC%83%81%ED%92%88%EC%83%81%EC%84%B8&t_number=16
2026-05-01,올리브영,판매량순,17,[2025 어워즈] VT 리들샷100 50ml 어워즈 기획 (+리들샷300스틱파우치 5개+PDRN에센스100 15ml),VT,50ml,32000,50%,15870,4.8,48692,,"[브이티 리들샷 100 ] 정제수, 다이프로필렌글라이콜, 글리세린, 나이아신아마이드, 부틸렌글라이콜, 마카다미아씨오일, 1,2-헥산다이올, 에틸헥실팔미테이트, 소듐아크릴레이트/소듐아크릴로일다이메틸타우레이트코폴리머, 폴리아이소부텐, 실리카, 글리세레스-26, 에틸헥실글리세린, 카프릴릴글라이콜, 아데노신, 소듐폴리아크릴레이트, 소듐하이알루로네이트, 병풀추출물, 카프릴릴/카프릴글루코사이드, 솔비탄올리에이트, 잔탄검, 프로폴리스추출물, 아시아티코사이드, 마데카소사이드, 마데카식애씨드, 아시아틱애씨드, 글루카신, 세린, 글루타믹애씨드, 아스파틱애씨드, 류신, 알라닌, 라이신, 알지닌, 타이로신, 페닐알라닌, 트레오닌, 프롤린, 발린, 아이소류신, 히스티딘, 메티오닌, 시스테인 [브이티 피디알엔 에센스 100] 정제수, 아이소프로필미리스테이트, 카프릴릴/카프릭트라이글리세라이드, 세틸에틸헥사노에이트, 글리세린, 프로판다이올, 나이아신아마이드, 폴리글리세릴-2다이폴리하이드록시스테아레이트, 피이지-30다이폴리하이드록시스테아레이트, 폴리글리세릴-3다이아이소스테아레이트, 1,2-헥산다이올, 토코페롤, 하이드록시아세토페논, 해바라기씨오일, 아크릴레이트/C10-30알킬아크릴레이트크로스폴리머, 알지닌, 아데노신, 세라마이드엔피, 바오밥나무씨오일, 다이소듐이디티에이, 하이드로제네이티드레시틴, 알란토인, 스쿠알란, 판테놀, 폴리글루타믹애씨드, 세라마이드엔에스, 세라마이드이오피, 세라마이드이오피, 산약삼추출물, 소듐디엔에이(0.5ppm)",,https://www.oliveyoung.co.kr/store/goods/getGoodsDetail.do?goodsNo=A000000240088&dispCatNo=100000100010014&trackingCd=Cat100000100010014_Small&t_page=%EC%B9%B4%ED%85%8C%EA%B3%A0%EB%A6%AC%EA%B4%80&t_click=%EC%97%90%EC%84%BC%EC%8A%A4/%EC%84%B8%EB%9F%BC/%EC%95%B0%ED%94%8C_%EC%A0%84%EC%B2%B4__%EC%83%81%ED%92%88%EC%83%81%EC%84%B8&t_number=17
2026-05-01,올리브영,판매량순,18,[5월 올영픽/글로벌대란템] 유세린 티아미돌 부스터 세럼 30ml 기획 (+마스크팩 1매+페이스쿨러),유세린,30ml,69000,44%,38900,4.9,109,,"[유세린 이븐래디언스 브라이트닝 부스터 세럼] 정제수,변성알코올,부틸렌글라이콜,글리세린,아이소프로필팔미테이트,세테아릴아이소노나노에이트,다이아이소프로필아디페이트,프로필헵틸카프릴레이트,다이스타치포스페이트,세테아릴알코올,하이드록시프로필스타치포스페이트,글리세릴스테아레이트,소듐하이알루로네이트,페녹시에탄올,향료,다이메티콘,토코페롤,에틸헥실글리세린,트라이소듐이디티에이,데하이드로잔탄검,소듐스테아로일글루타메이트,아이소부틸아미도티아졸릴레조시놀,잔탄검,소듐아스코빌포스페이트,젤란검,글루코실루틴,시트릭애씨드,창과감초뿌리추출물,아이소쿼시트린,소듐클로라이드 [유세린 울트라 센시티브 리페어 수퍼 수르스 마스크] 정제수,부틸렌글라이콜,글리세린,다이프로필렌글라이콜,판테놀,1,2-헥산다이올,프로판다이올,하이드록시아세토페논,폴리솔베이트20,카보머,알지닌,펜틸렌글라이콜,알란토인,4-t-부틸사이클로헥산올,에틸헥실글리세린,하이드록시에틸셀룰로오스,다이소듐이디티에이,하이알루로닉애씨드,하이드롤라이즈드하이알루로닉애씨드,소듐하이산알루로네이트,폴리솔베이드60,다이소듐포스페이트,소듐포스페이트,병풀뿌리추출물,프랑스해안송껍질추출물,병풀추출물,병풀잎추출물,아시아틱애씨드,아시아티코사이드,마데카식-애씨드,마데카소사이드 [페이스 쿨러] 재질: ABS+알루미늄",,https://www.oliveyoung.co.kr/store/goods/getGoodsDetail.do?goodsNo=A000000252128&dispCatNo=100000100010014&trackingCd=Cat100000100010014_Small&t_page=%EC%B9%B4%ED%85%8C%EA%B3%A0%EB%A6%AC%EA%B4%80&t_click=%EC%97%90%EC%84%BC%EC%8A%A4/%EC%84%B8%EB%9F%BC/%EC%95%B0%ED%94%8C_%EC%A0%84%EC%B2%B4__%EC%83%81%ED%92%88%EC%83%81%EC%84%B8&t_number=18
2026-05-01,올리브영,판매량순,19,[올리브영 1등 세럼/속보습세럼]토리든 다이브인 저분자 히알루론산 세럼 50ml,토리든,50ml,22000,29%,15680,4.7,9183,,"정제수, 부틸렌글라이콜, 글리세린, 다이프로필렌글라이콜, 1,2-헥산다이올, 판테놀 , 소듐하이알루로네이트, 하이드롤라이즈드하이알루로닉애씨드(500ppm), 소듐아세틸레이티드하이알루로네이트, 소듐하이알루로네이트크로스폴리머, 하이드롤라이즈드소듐하이알루로네이트, 알란토인, 트레할로스, 베타인, 프로판다이올, 쇠비름추출물, 버지니아풍년화추출물, 마데카소사이드, 마데카식애씨드, 세라마이드엔피, 베타-글루칸, 말라카이트추출물, 콜레스테롤, 펜틸렌글라이콜, 글리세릴아크릴레이트/아크릴릭애씨드코폴리머, 피브이엠/엠에이코폴리머, 폴리글리세릴-10라우레이트, 잔탄검, 트로메타민, 카보머, 에틸헥실글리세린,황금추출물,모란뿌리추출물",,https://www.oliveyoung.co.kr/store/goods/getGoodsDetail.do?goodsNo=A000000128643&dispCatNo=100000100010014&trackingCd=Cat100000100010014_Small&t_page=%EC%B9%B4%ED%85%8C%EA%B3%A0%EB%A6%AC%EA%B4%80&t_click=%EC%97%90%EC%84%BC%EC%8A%A4/%EC%84%B8%EB%9F%BC/%EC%95%B0%ED%94%8C_%EC%A0%84%EC%B2%B4__%EC%83%81%ED%92%88%EC%83%81%EC%84%B8&t_number=19
2026-05-01,올리브영,판매량순,20,[트러블모공] 디오디너리 나이아신아마이드 10% + 징크 1% 30ml,디오디너리,30ml,,,8700,4.6,14640,,"정제수, 나이아신아마이드, 펜틸렌글라이콜, 징크피씨에이, 다이메틸아이소소바이드, 타마린드씨검, 잔탄검, 아이소세테스-20, 에톡시다이글라이콜, 페녹시에탄올, 클로페네신",,https://www.oliveyoung.co.kr/store/goods/getGoodsDetail.do?goodsNo=A000000157350&dispCatNo=100000100010014&trackingCd=Cat100000100010014_Small&t_page=%EC%B9%B4%ED%85%8C%EA%B3%A0%EB%A6%AC%EA%B4%80&t_click=%EC%97%90%EC%84%BC%EC%8A%A4/%EC%84%B8%EB%9F%BC/%EC%95%B0%ED%94%8C_%EC%A0%84%EC%B2%B4__%EC%83%81%ED%92%88%EC%83%81%EC%84%B8&t_number=20
2026-05-01,올리브영,판매량순,21,[포켓몬 에디션] VT 피디알엔 에센스 100 30ml 더블 기획 (+포켓몬 장바구니 키링),VT,30ml,67500,47%,35500,4.9,5506,,"정제수, 아이소프로필미리스테이트, 카프릴릭/카프릭트라이글리세라이드, 세틸에틸헥사노에이트, 글리세린, 프로판다이올, 나이아신아마이드, 폴리글리세릴-2다이폴리하이드록시스테아레이트, 피이지-30다이폴리하이드록시스테아레이트, 폴리글리세릴-3다이아이소스테아레이트, 1,2-헥산다이올, 토코페롤, 하이드록시아세토페논, 해바라기씨오일, 아크릴레이트/C10-30알킬아크릴레이트크로스폴리머, 알지닌, 아데노신, 세라마이드엔피, 바오밥나무씨오일, 다이소듐이디티에이, 하이드로제네이티드레시틴, 알란토인, 스쿠알란, 판테놀, 폴리글루쿠로닉애씨드, 세라마이드엔에스, 세라마이드에이에스, 세라마이드이오피, 세라마이드에이피, 산양삼추출물, 소듐디엔에이(0.5ppm)",,https://www.oliveyoung.co.kr/store/goods/getGoodsDetail.do?goodsNo=A000000254065&dispCatNo=100000100010014&trackingCd=Cat100000100010014_Small&t_page=%EC%B9%B4%ED%85%8C%EA%B3%A0%EB%A6%AC%EA%B4%80&t_click=%EC%97%90%EC%84%BC%EC%8A%A4/%EC%84%B8%EB%9F%BC/%EC%95%B0%ED%94%8C_%EC%A0%84%EC%B2%B4__%EC%83%81%ED%92%88%EC%83%81%EC%84%B8&t_number=21
2026-05-01,올리브영,판매량순,22,[포켓몬 에디션] VT 리들샷 300 에센스 50ml 기획 (+PDRN 에센스 1.5ml*2+피카츄 러기지택),VT,50ml,43000,39%,26100,4.8,6176,,"정제수, 다이프로필렌글라이콜, 글리세린, 나이아신아마이드, 부틸렌글라이콜, 마카다미아씨오일, 1,2-헥산다이올, 에틸헥실팔미테이트, 실리카, 소듐아크릴레이트/소듐아크릴로일다이메틸타우레이트코폴리머, 폴리아이소부텐, 글리세레스-26, 에틸헥실글리세린, 카프릴릴글라이콜, 아데노신, 소듐폴리아크릴레이트, 병풀추출물, 소듐하이알루로네이트, 카프릴릴/카프릴글루코사이드, 솔비탄올리에이트, 잔탄검, 프로폴리스추출물, 아시아티코사이드, 마데카소사이드, 마데카식애씨드, 아시아틱애씨드, 글라이신, 세린, 글루타믹애씨드, 아스파틱애씨드, 류신, 알라닌, 라이신, 알지닌, 타이로신, 페닐알라닌, 트레오닌, 프롤린, 발린, 아이소류신, 히스티딘, 메티오닌, 시스테인",,https://www.oliveyoung.co.kr/store/goods/getGoodsDetail.do?goodsNo=A000000254064&dispCatNo=100000100010014&trackingCd=Cat100000100010014_Small&t_page=%EC%B9%B4%ED%85%8C%EA%B3%A0%EB%A6%AC%EA%B4%80&t_click=%EC%97%90%EC%84%BC%EC%8A%A4/%EC%84%B8%EB%9F%BC/%EC%95%B0%ED%94%8C_%EC%A0%84%EC%B2%B4__%EC%83%81%ED%92%88%EC%83%81%EC%84%B8&t_number=22
2026-05-01,올리브영,판매량순,23,[연어PDRN/미백천재앰플] 메디큐브 PDRN 핑크 펩타이드 앰플 30ml 기획(앰플10ml+수분크림 10ml),메디큐브,30ml,24800,24%,18910,4.7,22738,,"**PDRN 앰플 30ml 정제수,글리세린,다이프로필렌글라이콜,아이소프로필미리스테이트,글리세레스-26,나이아신아마이드,1,2-헥산다이올,소듐디엔에이,부틸렌글라이콜,폴리글리세린-3,소듐아크릴레이트/소듐아크릴로일다이메틸타우레이트코폴리머,폴리아이소부텐,아크릴레이트/C10-30알킬아크릴레이트크로스폴리머,이리추출물,트로메타민,글리세릴아크릴레이트/아크릴릭애씨드코폴리머,피브이엠/엠에이코폴리머,에틸헥실글리세린,카프릴릴글라이콜,향료,인도멀구슬나무잎추출물,아데노신,카프릴릴/카프릴글루코사이드,솔비탄올리에이트,인도멀구슬나무꽃추출물,소듐하이알루로네이트,다이소듐이디티에이,울금뿌리추출물,사이아노코발아민,하이드롤라이즈드콜라겐,유비퀴논,홀리바질잎추출물,참산호말추출물,팔미토일펜타펩타이드-4,팔미토일트라이펩타이드-1,팔미토일테트라펩타이드-7,카퍼트라이펩타이드-1,아세틸헥사펩타이드-8,연어알추출물,아텔로콜라겐 **PDRN 앰플 10ml 정제수,글리세린,다이프로필렌글라이콜,아이소프로필미리스테이트,글리세레스-26,나이아신아마이드,1,2-헥산다이올,소듐디엔에이,부틸렌글라이콜,폴리글리세린-3,소듐아크릴레이트/소듐아크릴로일다이메틸타우레이트코폴리머,폴리아이소부텐,아크릴레이트/C10-30알킬아크릴레이트크로스폴리머,이리추출물,트로메타민,글리세릴아크릴레이트/아크릴릭애씨드코폴리머,피브이엠/엠에이코폴리머,에틸헥실글리세린,카프릴릴글라이콜,향료,인도멀구슬나무잎추출물,아데노신,카프릴릴/카프릴글루코사이드,솔비탄올리에이트,인도멀구슬나무꽃추출물,소듐하이알루로네이트,다이소듐이디티에이,울금뿌리추출물,사이아노코발아민,하이드롤라이즈드콜라겐,유비퀴논,홀리바질잎추출물,참산호말추출물,팔미토일펜타펩타이드-4,팔미토일트라이펩타이드-1,팔미토일테트라펩타이드-7,카퍼트라이펩타이드-1,아세틸헥사펩타이드-8,연어알추출물,아텔로콜라겐 **PDRN 수분크림 10ml 정제수, 글리세레스-26, 부틸렌글라이콜, 카프릴릭/카프릭트라이글리세라이드, 사이클로펜타실록세인, 1,2-헥산다이올, 나이아신아마이드, 하이드로제네이티드폴리데센, 아이소노닐아이소노나노에이트, 세테아릴올리베이트, 에틸헥실올리베이트, 글리세린, 솔비탄올리베이트, 소듐디엔에이(5,000PPM), 소듐아크릴레이트코폴리머, 소듐폴리아크릴로일다이메틸타우레 이트, 하이드록시에틸아크릴레이트/소듐아크릴로일다이메틸타우레이트코폴리머, 폴리글리세릴-4올리에이트, 다이소듐이디티에이, 베타인, 판테놀, 향료, 에틸헥실글리세린, 아데노신, 솔비탄아이소스테아레이트, 메도우폼씨오일, 글리세릴아크릴레이트/아크릴릭애씨드코폴리머, 시트릭애씨드, 사이아노코발아민, 하이드로제네이티드레시틴, 세테아릴알코올, 스테아릭애씨드, 소듐하이알루로네이트(1.02PPM), 하이드록시프로필트라이모늄하이알루로네이트(0.1PPM), 세라마이드엔피, 꿀풀추출물, 블래더랙추출물, 노니열매추출물, 여주열매추출물, 오크라열매추출물, 세라마이드엔에스, 소듐아세틸레이티드하이알루로네이트(0.01PPM), 하이드롤라이즈드하이알루로닉애씨드(0.01PPM), 병풀잎추출물, 콜레스테롤, 피토스핑고신, 세라마이드에이에스, 세라마이드에이피, 하이알루로닉애씨드(0.0025PPM), 카퍼트라이펩타이드-1, 소듐하이알루로네이트크로스폴리머(0.001PPM), 아세틸헥사펩타이드-8, 팔미토일펜타펩타이드-4, 하이드롤라이즈드소듐하이알루로네이트(0.001PPM), 팔미토일테트라펩타이드-7, 팔미토일트라이펩타이드-1, 포타슘하이알루로네이트(0.0002PPM), 세라마이드이오피",,https://www.oliveyoung.co.kr/store/goods/getGoodsDetail.do?goodsNo=A000000243435&dispCatNo=100000100010014&trackingCd=Cat100000100010014_Small&t_page=%EC%B9%B4%ED%85%8C%EA%B3%A0%EB%A6%AC%EA%B4%80&t_click=%EC%97%90%EC%84%BC%EC%8A%A4/%EC%84%B8%EB%9F%BC/%EC%95%B0%ED%94%8C_%EC%A0%84%EC%B2%B4__%EC%83%81%ED%92%88%EC%83%81%EC%84%B8&t_number=23
2026-05-01,올리브영,판매량순,24,[흔적미백] 넘버즈인 5번 글루타치온C 흔적 앰플 30ml+30ml 듀오기획,넘버즈인,30ml,46000,37%,28900,4.7,17603,,"정제수, 부틸렌글라이콜, 나이아신아마이드(50,000 ppm), 판테놀(50,000 ppm), 트라넥사믹애씨드(40,000 ppm), 1,2-헥산다이올, 네오펜틸글라이콜다이카프레이트, 카프릴릭/카프릭트라이글리세라이드, 솔비톨, 월귤추출물, 아이리쉬모스추출물, 시어버터, 사탕수수추출물, 알파-알부틴, 비피다발효용해물, 소듐하이알루로네이트, 인도멀구슬나무꽃추출물, 홀리바질잎추출물, 인도멀구슬나무잎추출물, 울금뿌리추출물, 참산호말추출물, 흰목이버섯추출물, 펜틸렌글라이콜, 글리세린, 3-O-에틸아스코빅애씨드(2,000 ppm), 비사보롤, 트로메타민, 에틸헥실글리세린, 아데노신, 하이드로제네이티드레시틴, 알란토인, 글루타티온(100 ppm), 세라마이드엔피, 베타-글루칸, 다이포타슘글리시리제이트, 토코페롤, 아스코빅애씨드(1 ppb), 아스코빌글루코사이드(1 ppb), 토코페릴아세테이트, 하이드록시프로필사이클로덱스트린, 유비퀴논, 티옥틱애씨드, 포타슘하이드록사이드, 베헤닐알코올, 카보머, 잔탄검, 다이소듐이디티에이",,https://www.oliveyoung.co.kr/store/goods/getGoodsDetail.do?goodsNo=A000000189837&dispCatNo=100000100010014&trackingCd=Cat100000100010014_Small&t_page=%EC%B9%B4%ED%85%8C%EA%B3%A0%EB%A6%AC%EA%B4%80&t_click=%EC%97%90%EC%84%BC%EC%8A%A4/%EC%84%B8%EB%9F%BC/%EC%95%B0%ED%94%8C_%EC%A0%84%EC%B2%B4__%EC%83%81%ED%92%88%EC%83%81%EC%84%B8&t_number=24
